A1: LTE Quick Reference Go Back To Index Home : www.sharetechnote.com
A2: CQI <!-- google_ad_client = "ca-pub-9961293861045757"; /* Horiz_Wide_02 */ google_ad_slot = "7406076779"; google_ad_width = 728; google_ad_height = 90; //--> CQI stands for Channel Quality Indicator. As the name implies, it is an indicator carrying the information on how good/bad the communication channel quality is. This CQI is for HSDPA. (LTE also has CQI for its own purpose). CQI is the information that UE sends to the network and practically it implies the following two i) Current Communication Channel Quality is this-and-that.. ii) I (UE) wants to get the data with this-and-that transport block size, which in turn can be directly converted into throughput In HSDPA, the CQI value ranges from 0 ~ 30. 30 indicates the best channel quality and 0,1 indicates the poorest channel quality. Depending which value UE reports, network transmit data with different transport block size. If network gets high CQI value from UE, it transmit the data with larger transport block size and vice versa. What if network sends a large transport block even though UE reports low CQI, it is highly probable that UE failed to decode it (cause CRC error on UE side) and UE send NACK to network and the network have to retransmit it which in turn cause waste of radio resources. What if UE report high CQI even when the real channel quality is poor ? In this case, network would send a large transport block size according to the CQI value and it would become highly probable that UE failed to decode it (cause CRC error on UE side) and UE send NACK to network and the network have to retransmit it which in turn cause waste of radio resources. How UE can measure CQI ? This is the most unclear topic to me. As far as I know, there is no explicit description in any standard on the mechanism by which the CQI is calculated, but it is pretty obvious that the following factors play important roles to CQI measurement. signal-to-noise ratio (SNR) signal-to-interference plus noise ratio (SINR) signal-to-noise plus distortion ratio (SNDR) It is unclear how these factors are used and whether there is any other factors being involved. I was told the detailed CQI measurement algorithm is up UE implementation (chipset implementation). In LTE, there are 15 different CQI values randing from 1 to 15 and mapping between CQI and modulcation scheme, transport block size is defined as follows (36.213) If you are an engineer in Network (eNodeB) programming, you need to know the number of resource blocks and MCS for each CQI value to properly allocate the resources for each of UEs. With the modulation scheme in the table, you would get a certain range of MCS you can use for each CQI index. But you cannot pinpoint a specific MCS and Number of RBs. You need another condition to get the proper MCS and N RBs and it is 'Code Rate' shown in the table. But still there is not a single formula that would give you a single/determined value for MCS and NRB. You have to come up with a set of MCS and N RB that meet the modulation scheme and Code Rate requirement in the table. One example case can be as follows. Note 1 : Refer to Throughtput Calculation Example for determining N_RB, MCS, TBS determination. Note 2 : REs/PRB varies depending on CFI value as follows. Note 3 : I used the following formula explained in Code Rate section. v_CodingRate := (int2float(p_TBSize + 24)) / (int2float(p_N_PRB * tsc_REs_Per_PRB * v_BitsPerSymbol)); CQI is carried by PUCCH or PUSCH depending on the situation as follows. Carried by PUCCH : When there is no uplink data to be transmitted Carried by PUSCH : When there is uplink data to be transmitted. Regarding CQI report period and configuration, refer to CQI, PMI, RI Reporting Configuration part.

A1: CQI | B1: Modulation | C1: Bits/Symbol | D1: REs/PRB | E1: N_RB | F1: MCS | G1: TBS | H1: Code Rate
A2: 1 | B2: QPSK | C2: 2 | D2: 138 | E2: 20 | F2: 0 | G2: 536 | H2: =(G2+24)/(C2*D2*E2) -> 0.10144927536231885
A3: 2 | B3: QPSK | C3: 2 | D3: 138 | E3: 20 | F3: 0 | G3: 536 | H3: =(G3+24)/(C3*D3*E3) -> 0.10144927536231885
A4: 3 | B4: QPSK | C4: 2 | D4: 138 | E4: 20 | F4: 2 | G4: 872 | H4: =(G4+24)/(C4*D4*E4) -> 0.16231884057971013
A5: 4 | B5: QPSK | C5: 2 | D5: 138 | E5: 20 | F5: 5 | G5: 1736 | H5: =(G5+24)/(C5*D5*E5) -> 0.3188405797101449
A6: 5 | B6: QPSK | C6: 2 | D6: 138 | E6: 20 | F6: 7 | G6: 2417 | H6: =(G6+24)/(C6*D6*E6) -> 0.44221014492753624
A7: 6 | B7: QPSK | C7: 2 | D7: 138 | E7: 20 | F7: 9 | G7: 3112 | H7: =(G7+24)/(C7*D7*E7) -> 0.56811594202898552
A8: 7 | B8: 16QAM | C8: 4 | D8: 138 | E8: 20 | F8: 12 | G8: 4008 | H8: =(G8+24)/(C8*D8*E8) -> 0.36521739130434783
A9: 8 | B9: 16QAM | C9: 4 | D9: 138 | E9: 20 | F9: 14 | G9: 5160 | H9: =(G9+24)/(C9*D9*E9) -> 0.46956521739130436
A10: 9 | B10: 16QAM | C10: 4 | D10: 138 | E10: 20 | F10: 16 | G10: 6200 | H10: =(G10+24)/(C10*D10*E10) -> 0.56376811594202902
A11: 10 | B11: 64QAM | C11: 6 | D11: 138 | E11: 20 | F11: 20 | G11: 7992 | H11: =(G11+24)/(C11*D11*E11) -> 0.48405797101449277
A12: 11 | B12: 64QAM | C12: 6 | D12: 138 | E12: 20 | F12: 23 | G12: 9912 | H12: =(G12+24)/(C12*D12*E12) -> 0.600000
A13: 12 | B13: 64QAM | C13: 6 | D13: 138 | E13: 20 | F13: 25 | G13: 11448 | H13: =(G13+24)/(C13*D13*E13) -> 0.69275362318840583
A14: 13 | B14: 64QAM | C14: 6 | D14: 138 | E14: 20 | F14: 27 | G14: 12576 | H14: =(G14+24)/(C14*D14*E14) -> 0.76086956521739135
A15: 14 | B15: 64QAM | C15: 6 | D15: 138 | E15: 20 | F15: 28 | G15: 14688 | H15: =(G15+24)/(C15*D15*E15) -> 0.88840579710144929
A16: 15 | B16: 64QAM | C16: 6 | D16: 138 | E16: 20 | F16: 28 | G16: 14688 | H16: =(G16+24)/(C16*D16*E16) -> 0.88840579710144929

A1: CFI | B1: REs/PRB
A2: 1 | B2: 150
A3: 2 | B3: 138
A4: 3 | B4: 126